{
  "schemaVersion": "1.0.0",
  "caseId": "case-2026-EXAMPLE",
  "createdAt": "2026-02-17T10:30:00.000Z",
  "updatedAt": "2026-02-17T11:45:00.000Z",
  "sensitivityTag": "confidential",
  "retentionPolicy": {
    "retentionDays": 2555,
    "legalHold": false,
    "deleteAfter": "2033-02-17T10:30:00.000Z"
  },
  "items": [
    {
      "evidenceId": "ev-example001",
      "original": {
        "filename": "incident_photo.jpg",
        "sha256": "e3b0c44298fc1c149afbf4c8996fb92427ae41e4649b934ca495991b7852b855",
        "size": 1024000,
        "mime": "image/jpeg",
        "receivedAt": "2026-02-17T10:35:00.000Z",
        "source": {
          "channel": "whatsapp",
          "sender": "user-redacted",
          "messageId": "msg-example-001",
          "sessionId": "session-example"
        }
      },
      "metadata": {
        "exif": {
          "Make": "Example Manufacturer",
          "Model": "Example Model X",
          "DateTimeOriginal": "2026:02:17 10:30:00",
          "GPSLatitude": 0,
          "GPSLongitude": 0
        },
        "dimensions": {
          "width": 1920,
          "height": 1080
        }
      },
      "derivatives": [
        {
          "type": "thumbnail",
          "filename": "ev-example001-thumb.jpg",
          "sha256": "a7ffc6f8bf1ed76651c14756a061d662f580ff4de43b49fa82d80a4b80f8434a",
          "size": 51200,
          "generatedAt": "2026-02-17T10:40:00.000Z"
        }
      ],
      "vault": {
        "provider": "filesystem",
        "vaultUrl": "file:///evidence-vault/cases/case-2026-EXAMPLE/originals/ev-example001.jpg",
        "ingestedAt": "2026-02-17T10:42:00.000Z"
      }
    },
    {
      "evidenceId": "ev-example002",
      "original": {
        "filename": "recorded_audio.mp3",
        "sha256": "cf80cd8aed482d5d1527d7dc72fceff84e6326592848447d2dc0b0e87dfc9a90",
        "size": 5242880,
        "mime": "audio/mpeg",
        "receivedAt": "2026-02-17T11:00:00.000Z",
        "source": {
          "channel": "telegram",
          "sender": "user-redacted",
          "messageId": "msg-example-002",
          "sessionId": "session-example"
        }
      },
      "metadata": {
        "duration": 180,
        "author": "Unknown"
      },
      "derivatives": [
        {
          "type": "transcript",
          "filename": "ev-example002-transcript.txt",
          "sha256": "b5bb9d8014a0f9b1d61e21e796d78dccdf1352f23cd32812f4850b878ae4944c",
          "size": 2048,
          "generatedAt": "2026-02-17T11:15:00.000Z"
        }
      ],
      "vault": {
        "provider": "filesystem",
        "vaultUrl": "file:///evidence-vault/cases/case-2026-EXAMPLE/originals/ev-example002.mp3",
        "ingestedAt": "2026-02-17T11:20:00.000Z"
      }
    },
    {
      "evidenceId": "ev-example003",
      "original": {
        "filename": "document.pdf",
        "sha256": "7d865e959b2466918c9863afca942d0fb89d7c9ac0c99bafc3749504ded97730",
        "size": 256000,
        "mime": "application/pdf",
        "receivedAt": "2026-02-17T11:30:00.000Z",
        "source": {
          "channel": "email",
          "sender": "sender-redacted@example.com",
          "messageId": "msg-example-003",
          "sessionId": "session-example"
        }
      },
      "metadata": {
        "pages": 5,
        "author": "Document Author Redacted",
        "createdAt": "2026-02-15T08:00:00.000Z"
      },
      "derivatives": [],
      "vault": {
        "provider": "filesystem",
        "vaultUrl": "file:///evidence-vault/cases/case-2026-EXAMPLE/originals/ev-example003.pdf",
        "ingestedAt": "2026-02-17T11:35:00.000Z"
      }
    }
  ],
  "chainOfCustody": [
    {
      "event": "case_created",
      "timestamp": "2026-02-17T10:30:00.000Z",
      "actor": "system",
      "previousHash": null,
      "currentHash": "a1b2c3d4e5f67890abcdef1234567890abcdef1234567890abcdef1234567890"
    },
    {
      "event": "evidence_ingested",
      "timestamp": "2026-02-17T10:42:00.000Z",
      "actor": "session-example",
      "evidenceId": "ev-example001",
      "previousHash": "a1b2c3d4e5f67890abcdef1234567890abcdef1234567890abcdef1234567890",
      "currentHash": "b2c3d4e5f678901abcdef1234567890abcdef1234567890abcdef123456789012"
    },
    {
      "event": "evidence_ingested",
      "timestamp": "2026-02-17T11:20:00.000Z",
      "actor": "session-example",
      "evidenceId": "ev-example002",
      "previousHash": "b2c3d4e5f678901abcdef1234567890abcdef1234567890abcdef123456789012",
      "currentHash": "c3d4e5f6789012bcdef1234567890abcdef1234567890abcdef12345678901234"
    },
    {
      "event": "evidence_ingested",
      "timestamp": "2026-02-17T11:35:00.000Z",
      "actor": "session-example",
      "evidenceId": "ev-example003",
      "previousHash": "c3d4e5f6789012bcdef1234567890abcdef1234567890abcdef12345678901234",
      "currentHash": "d4e5f67890123cdef1234567890abcdef1234567890abcdef1234567890123456"
    },
    {
      "event": "manifest_updated",
      "timestamp": "2026-02-17T11:45:00.000Z",
      "actor": "system",
      "previousHash": "d4e5f67890123cdef1234567890abcdef1234567890abcdef1234567890123456",
      "currentHash": "e5f678901234def1234567890abcdef1234567890abcdef123456789012345678"
    }
  ]
}
